date,day_number,platform,content_format,topic_title,hook_line,key_points,cta,repurpose_notes,pillar
2026-08-04,30,TikTok,TikTok,The Problem With Most Oura vs Whoop Videos,They compare features. I am comparing actual decisions changed.,one contrarian claim; one chart or anecdote; one immediate action,Comment DATA and I’ll DM the dashboard template,Record natively with a tighter hook than the YouTube cut; reuse subtitles from the clip for an Instagram Story poll on Wednesday.,health-tech & tools
2026-08-05,31,Instagram,Story,What I’m Tracking Across All 3 Wearables This Month,"Sleep, HRV, resting heart rate, workouts, friction, battery, and whether the recommendation was actually actionable.",behind-the-scenes setup; one screenshot from the tracker; one poll or Q&A sticker,Reply FOUNDERS and I’ll share the exact checklist,Turn the best Story question into a Saturday TikTok response; archive the screenshots for a future monthly recap carousel.,founder journey/build-in-public
2026-08-05,31,TikTok,TikTok,How I Score Health Tech Like a Product Builder,A good dashboard is useless if the user experience makes you quit by day 10.,problem most creators oversimplify; what I tested instead; what changed in practice,Follow for the full Thursday write-up,Film as a direct-to-camera native explainer; lift the closing sentence into Thursday Substack email preview text.,science explainers
2026-08-06,32,Substack,Substack essay,"How I’m Benchmarking Oura, Whoop, and Apple Watch for Founder Longevity","This comparison starts with methodology, because wearable reviews without a rubric are just vibes.",methods and caveats; raw data table summary; evidence grade; founder-budget recommendation,Subscribe to the Founder Longevity Lab newsletter,Embed 2 chart screenshots from the week; spin out the strongest paragraph into Friday Instagram carousel caption and next Monday YouTube intro.,science explainers
2026-08-06,32,YouTube,YouTube Short,The One Question Most Wearable Reviews Ignore,I do not care which device wins in a lab if it fails during a shipping week.,single dramatic chart moment; one plain-English lesson; one next step,Watch the full breakdown on YouTube,Clip the highest-retention 30s moment from Monday’s long-form; repost natively to Instagram Reels on Thursday night if it spikes early.,health-tech & tools
2026-08-06,32,Instagram,Reel,The Hidden Cost of Wearables Is Not the Hardware,Subscriptions and mental overhead matter more than most reviewers admit.,one myth to correct; one mechanism or chart; one realistic founder action,Share this with a founder who is overcomplicating health,Use the same core script as the Thursday YouTube Short with a different first line; cut still frames into Story slides after publishing.,science explainers
2026-08-07,33,Instagram,carousel,Founder Criteria for Health Tech: What Counts as Signal,"If a metric does not help me train, sleep, or schedule better, it is dashboard wallpaper.",weekly scoreboard; one failed assumption; one win worth keeping; one adjustment for next week,Comment REVIEW and I’ll send the weekly scorecard format,Turn each slide into a separate Story frame; reuse the failed-assumption slide as the opening beat for Sunday notes or future recap content.,founder journey/build-in-public
2026-08-07,33,TikTok,TikTok,What My Apple Watch Still Does Better Than the New Health Apps,Sometimes the default tool wins because it is already on your wrist.,mistake or tension point; what the data said; what I changed next,Watch the full breakdown on YouTube,Use B-roll from the actual week and overlay the chart; mirror the strongest sentence in the Friday carousel caption.,founder journey/build-in-public
2026-08-08,34,TikTok,TikTok,The Founder Wearable Stack I’m Testing for 30 Days,"Three devices, one stressed schedule, and no patience for vanity metrics.",one concise verdict; one caveat; one next experiment or decision,Follow for next week’s experiment drop,Record as a direct response to the week’s top comment; pull the verdict sentence into Sunday notes and the next Monday cold open.,health-tech & tools
2026-08-10,36,YouTube,long-form video,Which Wearable Actually Caught My Bad Sleep Week?,"I had a brutal startup sleep stretch, which made this the best possible week to test whose data I can trust.",sleep onset and wake detection; HRV divergence; nap handling; which insights changed behavior,Subscribe to the Founder Longevity Lab newsletter,Cut 3x 45s vertical clips for TikTok Tue/Wed/Fri; pull 5 chart screenshots into an Instagram carousel on Tuesday.,health-tech & tools
2026-08-10,36,Instagram,Reel,My Worst Sleep Week Became the Best Wearable Test,A perfect routine flatters every device. A startup week exposes them.,week focus: Sleep tracking accuracy; one founder constraint; one measurable takeaway,Comment DASHBOARD and I’ll DM the tracking template,Re-edit the YouTube opener into a 35s Reel with on-screen charts; save strongest line for Thursday Story recap.,health-tech & tools
2026-08-10,36,TikTok,TikTok,My Wearables Disagreed on a Terrible Night of Sleep,"When all 3 devices tell different stories, you learn which one is actually useful.",arc: Wearable benchmark: Oura vs Whoop vs Apple Watch; strongest chart reveal; founder-budget takeaway,Follow for the next data drop in this 90-day series,Use a fast-cut native version of the Monday YouTube reveal; repost the best comment response as a Friday clip.,health-tech & tools
2026-08-11,37,Instagram,carousel,Sleep Tracking Showdown: The Charts Behind My 3 AM Wake-Ups,I lined up all 3 devices against the same nights. One was clearly more useful.,chart 1 baseline or comparison; chart 2 biggest surprise; chart 3 founder takeaway; chart 4 next test,Save this post for your next health stack audit,Export charts from the YouTube dashboard walkthrough; adapt slide 1 and slide 4 into a LinkedIn-style screenshot for future reuse.,health-tech & tools
2026-08-11,37,TikTok,TikTok,The Device That Best Caught My 3 AM Wake-Up,Only one made the interruption obvious enough to change what I did next.,one contrarian claim; one chart or anecdote; one immediate action,Comment DATA and I’ll DM the dashboard template,Record natively with a tighter hook than the YouTube cut; reuse subtitles from the clip for an Instagram Story poll on Wednesday.,health-tech & tools
2026-08-12,38,Instagram,Story,"My Bedtime, Last Meal, and Wearable Scores From the Roughest Night",This is what a real bad founder night looked like in the data.,behind-the-scenes setup; one screenshot from the tracker; one poll or Q&A sticker,Reply FOUNDERS and I’ll share the exact checklist,Turn the best Story question into a Saturday TikTok response; archive the screenshots for a future monthly recap carousel.,founder journey/build-in-public
2026-08-12,38,TikTok,TikTok,Stop Obsessing Over Sleep Scores,"If the score hides the reason you slept badly, it is not helping.",problem most creators oversimplify; what I tested instead; what changed in practice,Follow for the full Thursday write-up,Film as a direct-to-camera native explainer; lift the closing sentence into Thursday Substack email preview text.,science explainers
2026-08-13,39,Substack,Substack essay,Sleep Accuracy Under Real Founder Conditions: Oura vs Whoop vs Apple Watch,"This week’s comparison matters because founder sleep is messy, interrupted, and exactly where good wearables should help.",methods and caveats; raw data table summary; evidence grade; founder-budget recommendation,Subscribe to the Founder Longevity Lab newsletter,Embed 2 chart screenshots from the week; spin out the strongest paragraph into Friday Instagram carousel caption and next Monday YouTube intro.,science explainers
2026-08-13,39,YouTube,YouTube Short,Only One Device Nailed My 3 AM Wake-Ups,The gap between “somewhat right” and “actionably right” was bigger than I expected.,single dramatic chart moment; one plain-English lesson; one next step,Watch the full breakdown on YouTube,Clip the highest-retention 30s moment from Monday’s long-form; repost natively to Instagram Reels on Thursday night if it spikes early.,health-tech & tools
2026-08-13,39,Instagram,Reel,What Sleep Scores Get Wrong When Your Schedule Is Chaos,A single number can hide the exact pattern you need to fix.,one myth to correct; one mechanism or chart; one realistic founder action,Share this with a founder who is overcomplicating health,Use the same core script as the Thursday YouTube Short with a different first line; cut still frames into Story slides after publishing.,science explainers
2026-08-14,40,Instagram,carousel,The Sleep Metric I Trust More Than “Readiness”,One metric helped me make better choices faster than the recovery scores did.,weekly scoreboard; one failed assumption; one win worth keeping; one adjustment for next week,Comment REVIEW and I’ll send the weekly scorecard format,Turn each slide into a separate Story frame; reuse the failed-assumption slide as the opening beat for Sunday notes or future recap content.,founder journey/build-in-public
2026-08-14,40,TikTok,TikTok,The Founder Mistake That Broke My Sleep Data,Late laptop time made the entire dashboard uglier than any supplement could fix.,mistake or tension point; what the data said; what I changed next,Watch the full breakdown on YouTube,Use B-roll from the actual week and overlay the chart; mirror the strongest sentence in the Friday carousel caption.,founder journey/build-in-public
2026-08-15,41,TikTok,TikTok,What I Look At First Each Morning Now,It is not the flashy readiness score. It is the metric most tied to real choices.,one concise verdict; one caveat; one next experiment or decision,Follow for next week’s experiment drop,Record as a direct response to the week’s top comment; pull the verdict sentence into Sunday notes and the next Monday cold open.,health-tech & tools
2026-08-17,43,YouTube,long-form video,Oura vs Whoop vs Apple Watch for Training on a Founder Schedule,"I do not train like a pro athlete. I train between meetings, deadlines, and bad nights of sleep. That changes the verdict.",workout auto-detection; strain interpretation; recovery guidance usefulness; time-to-action tradeoffs,Subscribe to the Founder Longevity Lab newsletter,Cut 3x 45s vertical clips for TikTok Tue/Wed/Fri; pull 5 chart screenshots into an Instagram carousel on Tuesday.,health-tech & tools
2026-08-17,43,Instagram,Reel,How I Train When Startup Stress Is Higher Than Gym Stress,The best wearable for founders is the one that helps you avoid digging the fatigue hole deeper.,"week focus: Strain, workouts, and recovery; one founder constraint; one measurable takeaway",Comment DASHBOARD and I’ll DM the tracking template,Re-edit the YouTube opener into a 35s Reel with on-screen charts; save strongest line for Thursday Story recap.,health-tech & tools
2026-08-17,43,TikTok,TikTok,Founders Should Not Use Athlete Recovery Rules Blindly,"Your stress bucket includes fundraising, launches, and poor sleep, not just squats.",arc: Wearable benchmark: Oura vs Whoop vs Apple Watch; strongest chart reveal; founder-budget takeaway,Follow for the next data drop in this 90-day series,Use a fast-cut native version of the Monday YouTube reveal; repost the best comment response as a Friday clip.,health-tech & tools
2026-08-18,44,Instagram,carousel,"Training Day Comparison: 3 Wearables, 1 Workout, Very Different Advice","Same run, same lift, same body. The recommendations were not remotely identical.",chart 1 baseline or comparison; chart 2 biggest surprise; chart 3 founder takeaway; chart 4 next test,Save this post for your next health stack audit,Export charts from the YouTube dashboard walkthrough; adapt slide 1 and slide 4 into a LinkedIn-style screenshot for future reuse.,health-tech & tools
2026-08-18,44,TikTok,TikTok,I Compared 3 Wearables on the Same Workout Day,Only one gave advice I would trust before a hard training session.,one contrarian claim; one chart or anecdote; one immediate action,Comment DATA and I’ll DM the dashboard template,Record natively with a tighter hook than the YouTube cut; reuse subtitles from the clip for an Instagram Story poll on Wednesday.,health-tech & tools
2026-08-19,45,Instagram,Story,Would I Lift Today? The Wearable Check I Actually Use,This is the two-minute review I do before deciding to push or back off.,behind-the-scenes setup; one screenshot from the tracker; one poll or Q&A sticker,Reply FOUNDERS and I’ll share the exact checklist,Turn the best Story question into a Saturday TikTok response; archive the screenshots for a future monthly recap carousel.,founder journey/build-in-public
2026-08-19,45,TikTok,TikTok,The Metric I Ignore Before Workouts Now,"It looked scientific, but it made worse decisions during stressful weeks.",problem most creators oversimplify; what I tested instead; what changed in practice,Follow for the full Thursday write-up,Film as a direct-to-camera native explainer; lift the closing sentence into Thursday Substack email preview text.,science explainers
2026-08-20,46,Substack,Substack essay,Wearable Recovery Metrics: Which Ones Matter When You Cannot Train Like a Full-Time Athlete?,"A founder needs fast recovery guidance, not more friction. This week separated useful coaching from metric overload.",methods and caveats; raw data table summary; evidence grade; founder-budget recommendation,Subscribe to the Founder Longevity Lab newsletter,Embed 2 chart screenshots from the week; spin out the strongest paragraph into Friday Instagram carousel caption and next Monday YouTube intro.,science explainers
2026-08-20,46,YouTube,YouTube Short,The Recovery Score That Talked Me Out of a Bad Workout,One wearable finally gave guidance that matched how I actually felt.,single dramatic chart moment; one plain-English lesson; one next step,Watch the full breakdown on YouTube,Clip the highest-retention 30s moment from Monday’s long-form; repost natively to Instagram Reels on Thursday night if it spikes early.,health-tech & tools
2026-08-20,46,Instagram,Reel,Why “More Strain” Is a Dumb Founder Goal,"When recovery is constrained by work, pushing harder can become self-sabotage.",one myth to correct; one mechanism or chart; one realistic founder action,Share this with a founder who is overcomplicating health,Use the same core script as the Thursday YouTube Short with a different first line; cut still frames into Story slides after publishing.,science explainers
2026-08-21,47,Instagram,carousel,The Best Wearable for People Who Miss Workouts Sometimes,A tool that punishes imperfect routines is a bad tool for real operators.,weekly scoreboard; one failed assumption; one win worth keeping; one adjustment for next week,Comment REVIEW and I’ll send the weekly scorecard format,Turn each slide into a separate Story frame; reuse the failed-assumption slide as the opening beat for Sunday notes or future recap content.,founder journey/build-in-public
2026-08-21,47,TikTok,TikTok,What “Recovery” Means When You Slept 6 Hours and Still Have a Board Deck,This is why generic fitness advice misses founder reality.,mistake or tension point; what the data said; what I changed next,Watch the full breakdown on YouTube,Use B-roll from the actual week and overlay the chart; mirror the strongest sentence in the Friday carousel caption.,founder journey/build-in-public
2026-08-22,48,TikTok,TikTok,Which Wearable Helped Me Skip the Right Workout,"Sometimes the smartest training decision is to do less, not more.",one concise verdict; one caveat; one next experiment or decision,Follow for next week’s experiment drop,Record as a direct response to the week’s top comment; pull the verdict sentence into Sunday notes and the next Monday cold open.,health-tech & tools
2026-08-24,50,YouTube,long-form video,The Best Founder Wearable Is Not the Most Accurate One,"After 30 days, the winner came down to friction, consistency, and whether I actually used the recommendations.",battery and charging pain; app friction; habit adherence; final ranking by founder use-case,Subscribe to the Founder Longevity Lab newsletter,Cut 3x 45s vertical clips for TikTok Tue/Wed/Fri; pull 5 chart screenshots into an Instagram carousel on Tuesday.,health-tech & tools
2026-08-24,50,Instagram,Reel,My Founder Wearable Ranking After 30 Days,This ranking is not about feature count. It is about behavior change per dollar and per minute.,"week focus: Battery, friction, and final verdict; one founder constraint; one measurable takeaway",Comment DASHBOARD and I’ll DM the tracking template,Re-edit the YouTube opener into a 35s Reel with on-screen charts; save strongest line for Thursday Story recap.,health-tech & tools
2026-08-24,50,TikTok,TikTok,The Best Wearable for Founders Is the One You Keep Wearing,A perfect sensor with bad adherence loses to a good sensor with zero friction.,arc: Wearable benchmark: Oura vs Whoop vs Apple Watch; strongest chart reveal; founder-budget takeaway,Follow for the next data drop in this 90-day series,Use a fast-cut native version of the Monday YouTube reveal; repost the best comment response as a Friday clip.,health-tech & tools
2026-08-25,51,Instagram,carousel,The Wearable Comparison Table I Wish Existed Before I Bought Them,"Accuracy, comfort, charging, insight quality, and subscription cost on one page.",chart 1 baseline or comparison; chart 2 biggest surprise; chart 3 founder takeaway; chart 4 next test,Save this post for your next health stack audit,Export charts from the YouTube dashboard walkthrough; adapt slide 1 and slide 4 into a LinkedIn-style screenshot for future reuse.,health-tech & tools
2026-08-25,51,TikTok,TikTok,"I Spent 30 Days Wearing Oura, Whoop, and Apple Watch",Here is the ranking I would give a founder friend spending their own money.,one contrarian claim; one chart or anecdote; one immediate action,Comment DATA and I’ll DM the dashboard template,Record natively with a tighter hook than the YouTube cut; reuse subtitles from the clip for an Instagram Story poll on Wednesday.,health-tech & tools
2026-08-26,52,Instagram,Story,The Most Annoying Part of Wearing 3 Devices,The biggest downside was not just how they looked. It was how often they interrupted flow.,behind-the-scenes setup; one screenshot from the tracker; one poll or Q&A sticker,Reply FOUNDERS and I’ll share the exact checklist,Turn the best Story question into a Saturday TikTok response; archive the screenshots for a future monthly recap carousel.,founder journey/build-in-public
2026-08-26,52,TikTok,TikTok,The Wearable Cost Nobody Mentions,It is not just dollars. It is the cognitive tax of checking one more dashboard.,problem most creators oversimplify; what I tested instead; what changed in practice,Follow for the full Thursday write-up,Film as a direct-to-camera native explainer; lift the closing sentence into Thursday Substack email preview text.,science explainers
2026-08-27,53,Substack,Substack essay,My Final Wearable Verdict for Founders: Oura vs Whoop vs Apple Watch,The right answer depends less on perfect tracking and more on what you will actually wear and act on.,methods and caveats; raw data table summary; evidence grade; founder-budget recommendation,Subscribe to the Founder Longevity Lab newsletter,Embed 2 chart screenshots from the week; spin out the strongest paragraph into Friday Instagram carousel caption and next Monday YouTube intro.,science explainers
2026-08-27,53,YouTube,YouTube Short,The Wearable Winner Surprised Me for One Reason,"Accuracy mattered, but friction decided the outcome.",single dramatic chart moment; one plain-English lesson; one next step,Watch the full breakdown on YouTube,Clip the highest-retention 30s moment from Monday’s long-form; repost natively to Instagram Reels on Thursday night if it spikes early.,health-tech & tools
2026-08-27,53,Instagram,Reel,Why Subscription Cost Changes the Wearable Equation,A device can be “best” and still fail the founder-budget test.,one myth to correct; one mechanism or chart; one realistic founder action,Share this with a founder who is overcomplicating health,Use the same core script as the Thursday YouTube Short with a different first line; cut still frames into Story slides after publishing.,science explainers
2026-08-28,54,Instagram,carousel,What I’d Buy Again and What I Would Skip,"The final verdict is less glamorous than the internet wants, but more useful.",weekly scoreboard; one failed assumption; one win worth keeping; one adjustment for next week,Comment REVIEW and I’ll send the weekly scorecard format,Turn each slide into a separate Story frame; reuse the failed-assumption slide as the opening beat for Sunday notes or future recap content.,founder journey/build-in-public
2026-08-28,54,TikTok,TikTok,Which Device Had the Best Signal-to-Noise Ratio?,One app was clearly better at turning data into a next action.,mistake or tension point; what the data said; what I changed next,Watch the full breakdown on YouTube,Use B-roll from the actual week and overlay the chart; mirror the strongest sentence in the Friday carousel caption.,founder journey/build-in-public
2026-08-29,55,TikTok,TikTok,Would I Keep Triple-Wearing Devices?,Absolutely not. The whole point was to escape gadget theater with a real recommendation.,one concise verdict; one caveat; one next experiment or decision,Follow for next week’s experiment drop,Record as a direct response to the week’s top comment; pull the verdict sentence into Sunday notes and the next Monday cold open.,health-tech & tools
2026-08-31,57,YouTube,long-form video,"The $3,000 I Wasted on Longevity Tests and the $100/Month Stack I’m Keeping",I audited every health spend from the last year and built a founder version that survives both budget and time constraints.,cost audit by category; what stayed in the stack; what got cut immediately; time cost vs evidence level,Subscribe to the Founder Longevity Lab newsletter,Cut 3x 45s vertical clips for TikTok Tue/Wed/Fri; pull 5 chart screenshots into an Instagram carousel on Tuesday.,founder journey/build-in-public
2026-08-31,57,Instagram,Reel,How I Cut My Longevity Spend Without Cutting Results,The goal is not biohacker aesthetics. It is return on effort and return on dollars.,week focus: Full cost audit and stack reset; one founder constraint; one measurable takeaway,Comment DASHBOARD and I’ll DM the tracking template,Re-edit the YouTube opener into a 35s Reel with on-screen charts; save strongest line for Thursday Story recap.,founder journey/build-in-public
2026-08-31,57,TikTok,TikTok,The $200 Supplement That Lost to a $2 Habit,This is why I trust scorecards more than labels.,arc: $100/month founder longevity stack; strongest chart reveal; founder-budget takeaway,Follow for the next data drop in this 90-day series,Use a fast-cut native version of the Monday YouTube reveal; repost the best comment response as a Friday clip.,founder journey/build-in-public
2026-09-01,58,Instagram,carousel,"My Longevity Cost Audit: Every Dollar, Ranked by Usefulness",This is the spreadsheet I wish every wellness creator had to publish.,chart 1 baseline or comparison; chart 2 biggest surprise; chart 3 founder takeaway; chart 4 next test,Save this post for your next health stack audit,Export charts from the YouTube dashboard walkthrough; adapt slide 1 and slide 4 into a LinkedIn-style screenshot for future reuse.,founder journey/build-in-public
2026-09-01,58,TikTok,TikTok,I Audited My Entire Longevity Spend,"The numbers were more embarrassing than I expected, but useful.",one contrarian claim; one chart or anecdote; one immediate action,Comment DATA and I’ll DM the dashboard template,Record natively with a tighter hook than the YouTube cut; reuse subtitles from the clip for an Instagram Story poll on Wednesday.,founder journey/build-in-public
2026-09-02,59,Instagram,Story,What I Canceled First in My Health Budget,The easiest cuts were the things that looked premium and behaved like noise.,behind-the-scenes setup; one screenshot from the tracker; one poll or Q&A sticker,Reply FOUNDERS and I’ll share the exact checklist,Turn the best Story question into a Saturday TikTok response; archive the screenshots for a future monthly recap carousel.,founder journey/build-in-public
2026-09-02,59,TikTok,TikTok,Stop Confusing Expensive With Optimized,"Most founders need a better system, not a richer supplement drawer.",problem most creators oversimplify; what I tested instead; what changed in practice,Follow for the full Thursday write-up,Film as a direct-to-camera native explainer; lift the closing sentence into Thursday Substack email preview text.,science explainers
2026-09-03,60,Substack,Substack essay,The Founder-Budget Longevity Stack: What I’m Keeping Under $100/Month,"If a protocol cannot survive a startup budget and a crowded calendar, it does not belong in my system.",methods and caveats; raw data table summary; evidence grade; founder-budget recommendation,Subscribe to the Founder Longevity Lab newsletter,Embed 2 chart screenshots from the week; spin out the strongest paragraph into Friday Instagram carousel caption and next Monday YouTube intro.,science explainers
2026-09-03,60,YouTube,YouTube Short,The Most Overpriced Thing in My Longevity Routine,One purchase made me feel serious without making me healthier.,single dramatic chart moment; one plain-English lesson; one next step,Watch the full breakdown on YouTube,Clip the highest-retention 30s moment from Monday’s long-form; repost natively to Instagram Reels on Thursday night if it spikes early.,founder journey/build-in-public
